<?xml version="1.0" encoding="UTF-8"?>
<xs:schema xmlns:xs="http://www.w3.org/2001/XMLSchema" elementFormDefault="qualified">
  <xs:element name="Alumnos">
    <xs:complexType>
      <xs:sequence>
        <xs:element name="Separador" type="xs:string"/>
        <xs:element ref="Alumno" maxOccurs="unbounded"/>
      </xs:sequence>
    </xs:complexType>
  </xs:element>
  <xs:element name="Alumno">
    <xs:complexType>
      <xs:sequence>
        <xs:element name="Nombre" type="xs:string"/>
        <xs:element name="Nota" type="xs:string"/>
        <xs:element name="descripcion" type="xs:string"/>
      </xs:sequence>
    </xs:complexType>
  </xs:element>
</xs:schema>
